{
  "checks": {
    "all_declared_implementation_hashes_match": true,
    "all_outputs_are_explicitly_synthetic": true,
    "ambiguous_and_duplicate_writes_stop_closed": true,
    "both_pre_model_protocol_corrections_exercised": true,
    "eleven_scoped_runtime_tests_pass_without_resource_warnings": true,
    "fifteen_synthetic_end_to_end_checks_pass": true,
    "frozen_protocol_and_validation_unchanged": true,
    "invalid_output_and_worker_failure_are_preserved": true,
    "model_task_capture_gpu_gates_remain_closed": true,
    "no_top_level_tau_or_model_library_import": true,
    "private_scenario_evaluator_and_policy_boundaries_hold": true,
    "synthetic_output_matches_closed_schema_fields": true,
    "three_effect_class_captures_pass": true,
    "validation_output_matches_closed_schema_fields": true
  },
  "confirmatory_run_authorized": false,
  "gpu_used": false,
  "implementation_config_sha256": "ff655f917c71d0a1e74123ac96d1a45985904e240676065186f1ae59c0c63422",
  "model_loaded": false,
  "model_loading_authorized": false,
  "model_outputs_read": false,
  "next_gate": "freeze_one_shot_acquisition_runner_protocol",
  "one_shot_runner_protocol_design_authorized": true,
  "passed": true,
  "protocol_validation_sha256": "c05aa3da964e6dd2b076bae316e6a3cd110de764d596f95e1594d422169d8185",
  "real_branch_capture_authorized": false,
  "real_runner_implemented": false,
  "run_kind": "proper_v2_3_acquisition_runtime_implementation_validation",
  "schema_version": 1,
  "scoped_tests_run": 11,
  "synthetic_checks_run": 15,
  "synthetic_dry_run_sha256": "add4254f16d193f342ac3b5255b90537ee49a265a42f914c4d4bd278009d3caf",
  "task_executed": false,
  "tau_imported": false,
  "validation_input_sha256": {
    "configs/proper_v2_3/acquisition_runtime_implementation_v2_3.json": "ff655f917c71d0a1e74123ac96d1a45985904e240676065186f1ae59c0c63422",
    "experiments/proper_v2_3/run_acquisition_runtime_synthetic_cpu_v2_3.py": "56f4acf9c021fad8b1d2e2649cd7742864c9fa1622a9e5c053a284781960d174",
    "experiments/proper_v2_3/synthetic_acquisition_jsonl_worker_v2_3.py": "f8eaea15b00c9a603b5f0289ea27b16dd12f65b5f8a592856cd83fd0514b7081",
    "schemas/proper_v2_3/acquisition_runtime_implementation_validation.schema.json": "3bb8bad31d0ed804d3083e151fde504d261910395e3a7576f0c22515584f0bb9",
    "schemas/proper_v2_3/acquisition_runtime_synthetic_dry_run.schema.json": "20b4a30c3266bfbc7658e1e1e12d6d27b04399db66da395fcfb306047998653f",
    "src/failure_memory/proper_v2/v2_3/acquisition_runtime.py": "48dd52750e1f4364ba2754abb0ea97fe4983d7320e3b0ce65eb81b4a1b70835c",
    "src/failure_memory/proper_v2/v2_3/tau3_acquisition_runtime_adapter.py": "90140450b2db4050a7111d5f50604136278ff86ac779b9b340379b60bab53a0a",
    "tests/test_proper_v2_3_acquisition_runtime.py": "02535e933a4d3ebc7a820dc8f0febcef389f36e575fe18008aa037b85378697d"
  }
}
